{
  "$schema": "./benchmark-matrix.schema.json",
  "generatedAt": "2026-09-23T21:10:22.460Z",
  "models": [
    "deepseek-v4.1-flash",
    "glm-5.3-flash",
    "qwen3.8-flash",
    "mimo-v2.6-flash",
    "mimo-v2.6-pro",
    "muse-spark-1.3-contributor",
    "qwen3.8-27b-q2",
    "gemma-4-26b-a4b-q4",
    "k2-horizon-3.7b-q4",
    "k2-horizon-7b-q4"
  ],
  "scenarios": [
    {
      "id": "b13-chained-diff-edit",
      "focus": "core"
    },
    {
      "id": "b18-boundary-dup",
      "focus": "core"
    },
    {
      "id": "batch-edits",
      "focus": "core"
    },
    {
      "id": "bom",
      "focus": "core"
    },
    {
      "id": "crlf",
      "focus": "core"
    },
    {
      "id": "crlf-bom",
      "focus": "core"
    },
    {
      "id": "delete-line",
      "focus": "core"
    },
    {
      "id": "delete-range",
      "focus": "core"
    },
    {
      "id": "duplicate-import",
      "focus": "core"
    },
    {
      "id": "duplicate-nth",
      "focus": "core"
    },
    {
      "id": "empty-file",
      "focus": "core"
    },
    {
      "id": "insert-after",
      "focus": "core"
    },
    {
      "id": "insert-eof",
      "focus": "core"
    },
    {
      "id": "no-trailing-newline",
      "focus": "core"
    },
    {
      "id": "noop",
      "focus": "core"
    },
    {
      "id": "range",
      "focus": "core"
    },
    {
      "id": "replace-all",
      "focus": "core"
    },
    {
      "id": "single-line",
      "focus": "core"
    },
    {
      "id": "sub-line-token",
      "focus": "core"
    },
    {
      "id": "tabs",
      "focus": "core"
    },
    {
      "id": "undo",
      "focus": "core"
    },
    {
      "id": "unicode",
      "focus": "core"
    },
    {
      "id": "whitespace-only",
      "focus": "core"
    },
    {
      "id": "b10-duplicate-drift",
      "focus": "staleness"
    },
    {
      "id": "b12-noop-with-drift",
      "focus": "staleness"
    },
    {
      "id": "b15-large-range-drift",
      "focus": "staleness"
    },
    {
      "id": "b6-change-then-revert",
      "focus": "staleness"
    },
    {
      "id": "b9-boundary-changed",
      "focus": "staleness"
    },
    {
      "id": "error-guidance",
      "focus": "staleness"
    },
    {
      "id": "external-far",
      "focus": "staleness"
    },
    {
      "id": "formatter-drift",
      "focus": "staleness"
    },
    {
      "id": "insert-race-stale-boundary",
      "focus": "staleness"
    },
    {
      "id": "stale-line",
      "focus": "staleness"
    },
    {
      "id": "stale-range",
      "focus": "staleness"
    }
  ],
  "contenders": [
    "pi-hashline-edit-pro",
    "builtin-bash",
    "@xynogen/pix-edit",
    "builtin-edit",
    "pi-semantic-edit",
    "@cortexkit/aft-pi",
    "@agimon-ai/doompi-edit",
    "pi-hashline-readmap",
    "pi-edit-guard"
  ],
  "cells": [
    [
      [
        [
          0,
          1,
          2,
          3,
          4,
          5,
          6,
          7,
          8,
          9
        ],
        10
      ],
      [
        [
          0,
          1,
          2,
          3,
          4,
          5,
          6,
          7,
          8,
          9
        ],
        10
      ],
      [
        [
          0,
          1,
          2,
          3,
          4,
          5,
          6,
          7,
          8,
          9
        ],
        10
      ],
      [
        [
          0,
          1,
          2,
          3,
          4,
          5,
          6,
          7,
          8,
          9
        ],
        10
      ],
      [
        [
          0,
          1,
          2,
          3,
          4,
          5,
          6,
          7,
          8,
          9
        ],
        10
      ],
      [
        [
          0,
          1,
          2,
          3,
          4,
          5,
          6,
          7,
          9
        ],
        10
      ],
      [
        [
          0,
          1,
          2,
          3,
          4,
          5,
          6,
          7
        ],
        10
      ],
      [
        [
          0,
          1,
          2,
          3,
          4,
          5,
          6,
          7,
          8
        ],
        10
      ],
      [
        [
          0,
          1,
          2,
          3,
          4,
          5,
          6,
          7,
          8,
          9
        ],
        10
      ]
    ],
    [
      [
        [
          0,
          1,
          2,
          3,
          4,
          5,
          6,
          7,
          9
        ],
        10
      ],
      [
        [
          0,
          1,
          2,
          3,
          4,
          5,
          6,
          7,
          8,
          9
        ],
        10
      ],
      [
        [
          0,
          1,
          2,
          3,
          4,
          5,
          6,
          7,
          8,
          9
        ],
        10
      ],
      [
        [
          0,
          1,
          2,
          3,
          4,
          5,
          6,
          8,
          9
        ],
        10
      ],
      [
        [
          0,
          1,
          2,
          3,
          4,
          5,
          6,
          7,
          8,
          9
        ],
        10
      ],
      [
        [
          0,
          1,
          2,
          3,
          4,
          5,
          6,
          7,
          8,
          9
        ],
        10
      ],
      [
        [
          0,
          2,
          3,
          4,
          5,
          6,
          7,
          8,
          9
        ],
        10
      ],
      [
        [
          0,
          1,
          2,
          3,
          4,
          5,
          6,
          8,
          9
        ],
        10
      ],
      [
        [
          0,
          1,
          2,
          3,
          4,
          5,
          6,
          9
        ],
        10
      ]
    ],
    [
      [
        [
          0,
          1,
          2,
          3,
          4,
          5,
          6,
          7,
          9
        ],
        10
      ],
      [
        [
          0,
          1,
          2,
          3,
          4,
          5,
          6,
          7,
          8,
          9
        ],
        10
      ],
      [
        [
          0,
          1,
          2,
          3,
          4,
          5,
          6,
          7,
          8,
          9
        ],
        10
      ],
      [
        [
          0,
          1,
          2,
          3,
          4,
          5,
          6,
          7,
          8,
          9
        ],
        10
      ],
      [
        [
          0,
          1,
          2,
          3,
          4,
          5,
          6,
          7,
          8,
          9
        ],
        10
      ],
      [
        [
          9
        ],
        10
      ],
      [
        [
          0,
          1,
          2,
          3,
          4,
          5,
          6,
          7,
          8,
          9
        ],
        10
      ],
      [
        [
          0,
          1,
          2,
          3,
          4,
          5,
          6,
          7,
          8,
          9
        ],
        10
      ],
      [
        [
          0,
          1,
          2,
          3,
          4,
          5,
          6,
          7,
          8,
          9
        ],
        10
      ]
    ],
    [
      [
        [
          0,
          1,
          2,
          3,
          4,
          5,
          6,
          7,
          8,
          9
        ],
        10
      ],
      [
        [
          0,
          1,
          2,
          3,
          4,
          5,
          6,
          7,
          8,
          9
        ],
        10
      ],
      [
        [
          0,
          1,
          2,
          3,
          4,
          5,
          6,
          7,
          8,
          9
        ],
        10
      ],
      [
        [
          0,
          1,
          2,
          3,
          4,
          5,
          6,
          7,
          8,
          9
        ],
        10
      ],
      [
        [
          0,
          1,
          2,
          3,
          4,
          5,
          6,
          7,
          8,
          9
        ],
        10
      ],
      [
        [
          0,
          1,
          2,
          3,
          4,
          5,
          6,
          7,
          9
        ],
        10
      ],
      [
        [
          0,
          1,
          2,
          3,
          4,
          5,
          6,
          7,
          8
        ],
        10
      ],
      [
        [
          0,
          1,
          2,
          3,
          4,
          5,
          6,
          8
        ],
        10
      ],
      [
        [
          0,
          1,
          2,
          3,
          4,
          5,
          6,
          7,
          8,
          9
        ],
        10
      ]
    ],
    [
      [
        [
          0,
          1,
          2,
          3,
          4,
          5,
          6,
          7,
          8,
          9
        ],
        10
      ],
      [
        [
          0,
          1,
          2,
          3,
          4,
          5,
          6,
          7,
          8,
          9
        ],
        10
      ],
      [
        [
          0,
          1,
          2,
          3,
          4,
          5,
          6,
          7,
          8,
          9
        ],
        10
      ],
      [
        [
          0,
          1,
          2,
          3,
          4,
          5,
          6,
          7,
          8,
          9
        ],
        10
      ],
      [
        [
          0,
          1,
          2,
          3,
          4,
          5,
          6,
          7,
          8,
          9
        ],
        10
      ],
      [
        [
          0,
          2,
          3,
          4,
          5,
          6,
          7,